,mean_price,capacity,time,price,area,region,room_type,house_level,type,mean_price_level,price_level,title,labels,position
2142,22195,49,2015,110,12,91,"('3', '2')",6,48.0,3,3,新出房源急售，配套成熟，品质小区，拎包入住，采光无遮挡,"['送车位', '近地铁', '配套成熟']",1092.0
2143,48970,119,2015,585,14,119,"('3', '2')",23,184.0,4,4,买房子不在乎大与小，够住，符合预算，自己喜欢，就OK,"['配套成熟', '交通便利', '品质小区']",1666.0
2144,15957,47,2019,75,3,12,"('1', '2')",16,64.0,2,2,临安苕溪学府 地铁口500米 小面积住宅 70年产权 名校圈,[],36.0
2145,10333,84,2010,87,4,64,"('3', '2')",12,96.0,1,2,地铁口精装70年产权住宅房 首付20万 家电7万全送 送车位,"['南北通透', '送车位', '品质小区']",256.0
2146,10333,60,1900,62,13,98,"('2', '2')",16,96.0,1,1,急售)送产权车位|精装带家具家电全送可看房|房主工作调动置换,"['南北通透', '小户型', '环境优美']",1274.0
2147,13922,50,2014,69,13,33,"('2', '1')",18,54.0,2,2,首付只需15万 繁华地段 送车位 拎包入住 精装两房 无税,"['南北通透', '送车位', '环境优美']",429.0
2148,13179,47,2011,62,13,123,"('2', '2')",6,36.0,2,1,钱江世纪城现房 精装小两房 产证齐全 可过户 拎包入住 无税,"['南北通透', '配套成熟', '品质小区']",1599.0
2149,32480,82,2016,269,13,123,"('2', '2')",39,234.0,4,4,新出40万自住精装送大阳台民用水电通燃气丽晶国际 5米层高,"['近地铁', '繁华地段', '品质小区']",1599.0
2150,12667,60,2014,76,13,95,"('2', '2')",5,30.0,2,2,业主力推 70年产权 精装小两房 首付20W 产证清晰 无税,"['送车位', '配套成熟', '品质小区']",1235.0
2151,10820,61,2014,66,4,13,"('2', '2')",7,42.0,1,2,近地铁|品质小区|配套成熟|可落户上学|无需社保|无税精装,"['近地铁', '繁华地段', '品质小区']",52.0
2152,9077,65,2014,59,15,122,"('2', '2')",15,90.0,1,1,新挂牌急售 70年产权 可看可谈 外地人可购，可落户上学！,"['近地铁', '配套成熟', '品质小区']",1830.0
2153,12169,75,2013,92,15,122,"('3', '2')",7,56.0,1,2,外地人可买 首付10万 精装两房 低总价 业主急售 精装全送,"['南北通透', '近地铁', '繁华地段']",1830.0
2154,16954,138,2008,235,13,123,"('3', '2')",30,240.0,2,4,实价可谈 交通便利 大户型 三房两卫 精装修 采光好,"['南北通透', '环境优美']",1599.0
2155,7714,70,2014,54,13,123,"('2', '2')",16,96.0,1,1,钱江世纪城二手房，萧山区，无需社保，首付八万，即可落户上学！,"['南北通透', '近地铁', '品质小区']",1599.0
2156,29017,417,2016,1210,4,83,"('6', '3')",5,105.0,4,4,在家就能钓鱼！养花600平够不余杭科技城核心！地铁500米,"['新房房源', '南北通透', '环境优美']",332.0
2157,16726,92,2015,155,4,52,"('2', '2')",27,162.0,2,3,望府首付46起，带装修两房，楼层好，看房方便,[],208.0
2158,12800,200,2017,256,3,131,"('4', '3')",3,45.0,2,4,西湖客深夜挂牌，地铁口500米，即将涨24万，无税，原价急抛,"['近地铁', '环境优美', '次新小区']",393.0
2159,26067,83,2016,218,4,32,"('2', '2')",29,174.0,3,3,万科北宸之光 双阳台清爽精装 采光视野好 近地铁急降20万！,['南北通透'],128.0
2160,13500,400,2016,540,5,126,"('6', '2')",2,28.0,2,4,野风山别墅 6个套房 4大露台 3代独立生活空间带电梯井车库,['南北通透'],630.0
2161,30211,128,2000,388,13,33,"('3', '1')",6,24.0,4,4,拎包入住 离地铁近 周边配套齐全 户型方正,"['近地铁', '配套成熟', '交通便利']",429.0
2162,14596,88,2018,129,3,12,"('3', '2')",16,128.0,2,3,房东急售捡漏房 景观高层地铁口600米 买房送跨年演唱会门票,"['南北通透', '环境优美']",36.0
2163,9146,95,2015,87,14,117,"('3', '2')",11,88.0,1,2,房主诚售！70年产权精装三房，送权属车位，家电家具全送！！！,"['南北通透', '送车位', '交通便利']",1638.0
2164,11256,75,2014,84,13,50,"('2', '2')",15,90.0,1,2,70年产权住！首付15万！买房可落户 ！近地铁口！对口学校！,"['近地铁', '送车位', '拎包入住']",650.0
2165,24242,231,2010,560,5,126,"('5', '2')",3,36.0,3,4,上林湖二期新出排屋边套，南花园沿水系，双车位只要560万,['南北通透'],630.0
2166,24143,126,2009,305,4,111,"('3', '2')",5,40.0,3,4,良渚白鹭郡东精装大三房 繁华地段靠近地铁口 单价只要2万4,"['一梯两户', '环境优美', '交通便利']",444.0
2167,15873,63,2000,100,4,13,"('2', '2')",6,36.0,2,2,步行街30米 大两房 南北通透 二小三中 菜场50米降价急售,"['近地铁', '配套成熟', '环境优美']",52.0
2168,21676,138,2012,300,4,25,"('4', '2')",6,60.0,3,4,降价急售   见钱就卖 五常板块正气大四房  精装修拎包入住,"['近地铁', '配套成熟', '环境优美']",100.0
2169,36078,63,1997,230,2,96,"('2', '1')",7,21.0,4,3,红枫苑 方正两室 南北通透 近地铁好房，房东很诚心出售,['近学校'],192.0
2170,26798,67,1995,180,7,54,"('2', '1')",6,18.0,3,3,地铁口20万精装修2房 水晶城旁 低于市价15万 诚心出售,['近学校'],378.0
2171,11806,72,2012,85,4,109,"('2', '2')",18,108.0,1,2,繁华地段 产证齐全 可落户外地人可买 看中价格可谈 房东急售,"['配套成熟', '繁华地段', '品质小区']",436.0
2172,15115,95,2018,145,3,12,"('3', '2')",18,144.0,2,3,（宝龙广场已开业）吃喝玩乐购一站式配套，地铁口沿线，无需社保,"['新房房源', '配套成熟', '环境优美']",36.0
2173,4394,66,2014,29,15,56,"('2', '2')",15,90.0,1,1,急售 不限购 70年产权外地人可买 可落户上学送车位交通方便,"['配套成熟', '交通便利', '品质小区']",840.0
2174,7692,65,2013,50,3,12,"('2', '2')",13,78.0,1,1,5楼边套送观景阳台，外地人可买，首付三成过户无需摇号.,"['送家电', '送车位', '品质小区']",36.0
2175,12421,95,2018,118,3,12,"('3', '2')",18,144.0,2,3,青山湖宝龙旭辉城，89平三房两卫，青山湖地铁口，自带配套,"['新房房源', '南北通透', '近地铁']",36.0
2176,8961,60,2014,54,4,111,"('2', '2')",16,96.0,1,1,首付13万，外地人可买，精装修送产权车位，可落户上学随时看房,"['送车位', '近地铁', '配套成熟']",444.0
2177,7000,60,2012,42,13,33,"('2', '2')",12,72.0,1,1,近地铁 外地人可买 产证齐全 送精装 送车位 价格可谈,"['近地铁', '繁华地段', '品质小区']",429.0
2178,20225,89,2015,180,4,128,"('3', '2')",34,272.0,3,3,桃源小镇 次新小区 精装三房 未入住过 房东诚心出售 总价低,['南北通透'],512.0
2179,23636,55,1985,130,13,50,"('2', '1')",4,12.0,3,3,新上 江寺小（学）回澜初中 单价2.6万 无税离地铁600米,"['近地铁', '环境优美', '繁华地段']",650.0
2180,22449,49,2018,110,4,83,"('2', '1')",18,54.0,3,3,杭州未来科技城 双地铁口 首付三成 近浙一医院 总价百来万,"['交通便利', '繁华地段', '品质小区']",332.0
2181,9111,87,2013,80,13,16,"('3', '2')",11,88.0,1,2,临雅苑 精装婚房 南北通透 东西全带 包更名费 近地铁急售！,"['配套成熟', '环境优美', '交通便利']",208.0
2182,18126,88,2014,160,4,78,"('3', '2')",15,120.0,3,3,星桥地铁口 配套齐全 南北通透户型方正 小区环境优美,"['安全性高', '繁华地段', '品质小区']",312.0
2183,9692,65,2013,63,10,1,"('2', '2')",16,96.0,1,1,满五无税 无社保可买 首付18万 价格可谈 上学方便低总价,"['厅带阳台', '配套成熟', '品质小区']",10.0
2184,6840,82,2013,56,13,33,"('3', '2')",17,136.0,1,1,急售！急售！首付17万！精装三房！70年产权住宅！可落户上学,"['近地铁', '繁华地段', '品质小区']",429.0
2185,35674,89,2012,320,10,49,"('3', '2')",16,128.0,4,4,火车东站15年次新商品房全明三房30万自住精装 家电家具全,"['近地铁', '南北通透', '配套成熟']",490.0
2186,16021,47,2011,75,4,13,"('2', '2')",6,36.0,2,2,临平现房 精装两房 产齐全 可过户 送19平 拎包入住无税,"['南北通透', '环境优美']",52.0
2187,7000,10,2012,7,13,123,"('3', '2')",17,136.0,1,1,地铁口首付3万精装修70年产权住宅外地可购买可以落户,"['交通便利', '繁华地段', '品质小区']",1599.0
2188,14872,39,2012,58,13,33,"('2', '2')",12,72.0,2,1,近地铁近学校 包租5000 精装LOFT 挑高5米 随时看房,"['近地铁', '配套成熟', '品质小区']",429.0
2189,21719,32,2013,69,2,59,"('2', '2')",28,168.0,3,2,地铁口首付5万丨外地人可落户杭州丨精装两房送车位丨赠送12平,"['近地铁', '全南户型', '配套成熟']",118.0
2190,17676,113,2006,200,4,109,"('3', '2')",11,88.0,2,3,御景城  小区中心位置 电梯房 三房两厅两卫 房东急售看房有,[],436.0
2191,11680,86,2016,100,4,107,"('3', '2')",6,48.0,1,2,免费过户！业主置换，保养超好，南向精装三房，随时可看真实在售,"['南北通透', '一梯两户', '近地铁']",428.0
2192,10080,55,2013,55,4,14,"('3', '2')",17,136.0,1,1,不限够 余杭产业园区 包租4000 投姿佳选 浅力地段 可看,"['南北通透', '配套成熟', '繁华地段']",56.0
2193,32395,89,2016,290,13,67,"('2', '2')",31,186.0,4,4,房东工作调动卖房 30万装修 满两年 带车位 拎包入住 急卖,"['近地铁', '拎包入住', '配套成熟']",871.0
2194,9375,40,2014,37,15,18,"('2', '2')",18,108.0,1,1,一线江景房! 地铁口五百米 70年大产权 外地人即买即落户,"['景观房', '送车位', '近地铁']",270.0
2195,12703,37,2014,47,10,4,"('2', '2')",18,108.0,2,1,配套成熟 近地铁 可落户上学 无需社保 满五无税 送产权车位,"['近地铁', '繁华地段', '品质小区']",40.0
2196,12965,81,2016,105,13,67,"('3', '2')",6,48.0,2,3,拒绝假房源，舒适大三室，小区配套完善，交通便利，拎包入住！,"['近地铁', '南北通透', '送家电']",871.0
2197,14759,40,2014,59,13,50,"('2', '2')",16,96.0,2,1,来电立减！产齐全 产权清晰 精装修送车位 可落户上学 无税,"['配套成熟', '交通便利', '繁华地段']",650.0
2198,17654,82,2014,146,4,52,"('2', '2')",23,138.0,2,3,房东委托房源 有车位 刚需首买小区中心位置 楼层好 看房随时,"['环境优美', '繁华地段', '品质小区']",208.0
2199,12111,18,2015,21,2,9,"('2', '2')",18,108.0,1,1,（首付7万！精装入住！）恋爱没房白忙一场！一套好房轻松得女友,"['近地铁', '繁华地段', '品质小区']",18.0
2200,26056,36,2013,93,1,94,"('2', '2')",28,168.0,3,2,首付9万  精装2房  拎包入住  月租金8000 急卖！,"['送车位', '配套成熟', '繁华地段']",94.0
2201,12207,58,2014,70,4,14,"('2', '2')",12,72.0,1,2,外地人可买，首付11万，临平商圈，地铁口精装修，送车位,"['近地铁', '配套成熟', '品质小区']",56.0
2202,12222,45,2012,55,4,13,"('2', '1')",12,36.0,1,1,（首付15万！实得75平！）外地人可买！送精装！可落户可上学,"['送车位', '配套成熟', '素质住户']",52.0
2203,15169,89,2015,135,3,131,"('4', '2')",17,170.0,2,3,临安轻轨口，青山湖科技城，自住两相宜,"['环境优美', '交通便利', '素质住户']",393.0
2204,6615,65,2014,43,13,77,"('3', '2')",7,56.0,1,1,（投姿必看），真实在售，外地人可买，高性价比房源，随时可看。,"['南北通透', '近地铁', '交通便利']",1001.0
2205,12648,80,2016,101,4,13,"('3', '2')",6,48.0,2,3,花园社区，人车分流，温馨住家装修，正南采光位置安静，诚心出售,"['南北通透', '一梯两户', '配套成熟']",52.0
2206,34750,76,2000,265,2,82,"('2', '2')",7,42.0,4,4,多层3楼带中央空调  2房朝南15万婚房精装修 地铁口1号线,"['近地铁', '近学校', '安全性高']",164.0
2207,9474,76,2019,72,8,45,"('2', '2')",5,30.0,1,2,高尔夫球场对面 环境好 高品质洋房 小区人车分流 地铁口,"['新房房源', '配套成熟', '繁华地段']",360.0
2208,22500,20,2015,45,14,75,"('3', '2')",13,104.0,3,1,惊呆了丨首付8万丨公积金贷款丨投姿必选丨无需社保丨即购买丨,"['近学校', '近地铁', '配套成熟']",1050.0
2209,8000,35,2014,28,13,33,"('3', '2')",9,72.0,1,1,急售首付9万，无需社保，70年产权，精致装修送车位，指纹入户,"['配套成熟', '交通便利', '素质住户']",429.0
2210,14800,10,2013,14,2,60,"('2', '2')",17,102.0,2,1,主城区繁华地段.配套成熟.外地人可买.产证齐全.赠车位！！,"['近地铁', '配套成熟', '繁华地段']",120.0
2211,31658,78,2015,250,13,77,"('3', '2')",27,216.0,4,4,地铁口融科东南海刚需三房250万带车位精装 自带物业和综合体,"['南北通透', '环境优美']",1001.0
2212,17778,18,2014,32,14,40,"('2', '2')",11,66.0,2,1,首付8万 70年产权 外地人可购买 精装修送30平 拎包入住,"['南北通透', '近地铁', '繁华地段']",560.0
2213,17632,38,2016,67,12,34,"('2', '2')",10,60.0,2,2,急售！首付22万低于市场价，价可议，无需社保，产证齐全精装修,"['配套成熟', '交通便利', '品质小区']",408.0
2214,16883,77,2017,130,3,131,"('2', '2')",33,198.0,2,3,青山湖科技城现房 越秀地产 大两房 地铁口500米 130万,['南北通透'],393.0
2215,4494,89,2009,40,15,56,"('3', '2')",6,48.0,1,1,实际面积89平！首付10万！外地人可买！送装修送车位！,"['近地铁', '配套成熟', '品质小区']",840.0
2216,41219,84,2004,349,2,82,"('3', '2')",7,56.0,4,4,95方大三房格局，25万精装修，视野开阔，价格可谈，有钥匙！,"['近地铁', '近学校', '南北通透']",164.0
2217,9933,74,2015,74,13,77,"('2', '2')",13,78.0,1,2,房东置换新房！地铁口精装住宅 口对名校 首付12万 送18平,"['近地铁', '南北通透', '配套成熟']",1001.0
2218,12500,48,2014,60,4,109,"('2', '2')",13,78.0,2,1,70年产权住宅房 首付十二万无需社保 可落户 不限购 不限贷,"['南北通透', '配套成熟', '品质小区']",436.0
2219,10625,40,2014,42,4,13,"('2', '2')",9,54.0,1,1,急抛！！临平地铁口！精装修双钥匙！附赠18平！送地下车库！,"['南北通透', '小户型', '配套成熟']",52.0
2220,15795,83,2012,132,4,13,"('3', '2')",6,48.0,2,3,1号线地铁附近，16年30万豪华装修，送一个产权车，看房随时,"['位置安静', '送车位', '近地铁']",52.0
2221,19168,99,2006,189,4,13,"('2', '2')",11,66.0,3,3,东方俊园 电梯房送露台 南北双露台 价格美丽 采光好,"['配套成熟', '环境优美', '品质小区']",52.0
2222,9500,80,2012,76,15,56,"('3', '2')",6,48.0,1,2,急，急，急卖 业主急售 先到先得 近地铁 性价比高外地人可买,"['小户型', '近地铁', '繁华地段']",840.0
2223,18874,60,2013,115,4,20,"('2', '2')",11,66.0,3,3,近地铁，直降15万，外地人可购买，落户杭州，精装修送车位,"['近地铁', '繁华地段', '品质小区']",80.0
2224,8706,85,2012,74,4,14,"('3', '2')",9,72.0,1,2,三开间朝南 厨卫全明 首付20万精装修 可拎包入住 欢迎来电,"['环境优美', '繁华地段', '品质小区']",56.0
2225,11250,40,2013,45,4,13,"('2', '2')",15,90.0,1,1,精装两房，复式6米，民用水电，投姿包租，租金四千，送车位哦。,"['送车位', '繁华地段', '品质小区']",52.0
2226,13137,51,2013,67,13,67,"('2', '2')",23,138.0,2,2,70年产权，外地人可买，包落户上学，不限购不限贷，附带车位！,"['配套成熟', '交通便利', '繁华地段']",871.0
2227,11435,50,2013,58,4,52,"('2', '2')",17,102.0,1,1,捡漏捡漏!首付仅需15万，70年产权，五证齐全，精装修送车位,"['近地铁', '繁华地段', '品质小区']",208.0
2228,13752,20,2012,28,14,119,"('2', '2')",12,72.0,2,1,首付仅需6万，附赠21平米，包租4000起，以租养贷，精装修,"['配套成熟', '繁华地段', '品质小区']",1666.0
2229,48707,46,1987,226,10,31,"('2', 0)",6,0.0,4,3,采荷二小，特级二幼，2房朝南，中间楼层，精装修，可拎包入住！,[],310.0
2230,12635,54,2015,69,10,103,"('2', '2')",7,42.0,2,2,70年产权住宅！首付15万！外地人可买！可落户上学 ！可议价,"['近地铁', '配套成熟', '品质小区']",1030.0
2231,8904,73,2011,65,14,117,"('3', '2')",16,128.0,1,2,急降六W西湖大学旁！外地可买！免社保可落户！包税上学拎包入住,"['配套成熟', '繁华地段', '品质小区']",1638.0
2232,12340,47,2012,58,4,64,"('2', '2')",13,78.0,2,1,余杭崇贤 包租4000起 精装修 送车位 赠送15平 无税费,"['南北通透', '配套成熟', '品质小区']",256.0
2233,13692,65,2013,89,4,128,"('3', '2')",12,96.0,2,2,首付20W 业主急售 70产产证齐全 精装送车位,"['配套成熟', '繁华地段', '品质小区']",512.0
2234,19000,40,2017,76,4,83,"('1', '2')",24,96.0,3,2,未来科技城 海康威视对面 豪华装公寓地铁500米  低总价,"['配套成熟', '交通便利', '繁华地段']",332.0
2235,10303,66,2011,68,13,98,"('2', '2')",19,114.0,1,2,此房只因天上有！首付16万！近地铁！外地可买，无稅精装住宅！,"['全南户型', '近地铁', '品质小区']",1274.0
2236,13000,40,2013,52,13,33,"('2', '2')",15,90.0,2,1,地铁口 包租5千 投姿手选 萧山区政府 精装复式 浅力地段,"['南北通透', '配套成熟', '繁华地段']",429.0
2237,17683,41,2016,72,12,127,"('3', '2')",20,160.0,2,2,"首付24万，来电可议价， 租金5千,楼下就是商业综合体送车位","['配套成熟', '交通便利', '品质小区']",1524.0
2238,16933,60,2015,101,14,120,"('2', '2')",17,102.0,2,3,老客户诚售 地铁口精装loft免稅复式 买房送跨年演唱会门票,"['南北通透', '配套成熟', '繁华地段']",1680.0
2239,40000,10,2013,40,14,58,"('3', '2')",15,120.0,4,1,首付9万，70年产权住宅，7号线地铁口，外地人可买，配套齐全,"['送车位', '近地铁', '繁华地段']",812.0
2240,18537,41,2019,76,3,12,"('1', '2')",16,64.0,3,2,（杭州唯一不限购）错过再无！首付25万地铁口住宅 带恒温泳池,"['新房房源', '南北通透', '近地铁']",36.0
2241,16949,59,2013,100,15,6,"('2', '2')",17,102.0,2,2,新出保利湾天地59方跃层纯边套， 可做三房得房略 有钥匙,"['配套成熟', '交通便利', '素质住户']",90.0
2242,15115,33,2013,49,13,123,"('2', '2')",15,90.0,2,1,包租4000 振宁路地铁口 5米精装两房 价格可谈 车位阳台,"['南北通透', '配套成熟', '品质小区']",1599.0
2243,20769,65,2015,135,15,55,"('3', '2')",11,88.0,3,3,（钱塘新区精致小三房）无需社保，70年产权无抵押，赠送15平,"['南北通透', '一梯两户', '小区中心']",825.0
2244,72539,67,1994,490,14,58,"('3', '1')",5,20.0,4,4,下宁巷 小区中间位置，闹中取静，采光无遮挡，不占学籍,[],812.0
2245,10909,66,2014,72,4,13,"('3', '2')",12,96.0,1,2,精装大三房 首付15万 外地人可买 租金4500 产证齐全,"['送车位', '近地铁', '繁华地段']",52.0
2246,10357,47,2013,49,10,23,"('3', '2')",18,144.0,1,1,一手交钱一手过户。无需社保，买房即可落户。紧急换钱，回家过年,"['近地铁', '配套成熟', '繁华地段']",230.0
2247,10462,65,2012,68,8,45,"('3', '2')",15,120.0,1,2,（急售）地铁口 精装三房 拎包入住 送车位 总价低 价格可谈,"['近地铁', '繁华地段', '品质小区']",360.0
2248,13582,67,2013,91,15,7,"('2', '2')",28,168.0,2,2,江干区房东急售|外地人可买|品质小区|送豪华家具|对口名校,"['南北通透', '送家电', '送车位']",105.0
2249,7108,83,2014,59,4,13,"('3', '2')",17,136.0,1,1,爱她就给她一个家~首付7万！70年产权住宅！精装修随时入住！,"['近地铁', '交通便利', '繁华地段']",52.0
2250,12651,83,2013,105,13,114,"('2', '2')",17,102.0,2,3,急售！70年产权住宅房 外地人可买 可落户可上学 交通便利,"['南北通透', '环境优美', '品质小区']",1482.0
2251,9423,41,2013,39,15,18,"('3', '2')",15,120.0,1,1,外地人可买，看房马上减80000，买房即可落户上学，带车位。,"['近地铁', '配套成熟', '繁华地段']",270.0
2252,12000,20,2014,24,13,98,"('3', '2')",19,152.0,1,1,赠送26平，外地人可买，可落户上学，送精装修送车位，满五无税,"['南北通透', '配套成熟', '品质小区']",1274.0
2253,18857,35,2014,66,15,122,"('2', '2')",21,126.0,3,2,产证齐全！首付15万！地铁口！挑高5米4！通燃气！送车位！,"['近地铁', '南北通透']",1830.0
2254,5125,80,2012,41,15,56,"('2', '2')",12,72.0,1,1,外地人可买 价格可谈 近学校 近医院 送精装 送车位 送家具,"['近地铁', '繁华地段', '品质小区']",840.0
2255,11786,56,2013,66,4,13,"('2', '2')",16,96.0,1,2,首付9万！精装修送车位！外地可买可落户！产证五齐！近地铁！,"['配套成熟', '交通便利', '品质小区']",52.0
2256,7861,86,2018,68,8,93,"('3', '2')",33,264.0,1,2,地铁300米 紧邻财政大厦 对面吉利总部 现房 上市集团开发,[],744.0
2257,9149,47,2014,43,14,104,"('2', '2')",13,78.0,1,1,喜讯！西湖区超热门楼盘！首付8万！外地人能买！可落户上学！,[],1456.0
2258,18595,126,2014,235,13,17,"('3', '2')",18,144.0,3,4,捡漏金域兰庭 新上 东边套户 家具家电齐全,"['两房朝南', '景观房', '品质小区']",221.0
2259,15600,70,2014,109,10,110,"('3', '2')",15,120.0,2,3,房东偷情黑社会老大的女人，胆子忒大！现要求赔偿故来卖房！,"['近地铁', '繁华地段', '品质小区']",1100.0
2260,21824,89,2016,195,4,11,"('3', '2')",18,144.0,3,3,中泰地铁正式运营，地铁口离小区100米，送车位一个，拎包入住,"['送车位', '房型正', '近地铁']",44.0
2261,13906,64,2012,89,13,114,"('3', '2')",12,96.0,2,2,急售，附赠19平!70年产权住宅房!外地人可买!精装送车位！,"['近地铁', '次新小区', '交通便利']",1482.0
2262,11340,97,2012,110,3,12,"('4', '2')",11,110.0,1,3,急售，外地人可买，近地铁，70年产权住宅房，可落户上学，无税,"['配套成熟', '繁华地段', '品质小区']",36.0
2263,22400,25,2011,56,13,50,"('2', '2')",17,102.0,3,1,首付15万，产证齐全，无需社保，落户可读书，送车位老业主包税,"['近地铁', '近学校', '配套成熟']",650.0
2264,22242,89,2016,200,13,17,"('4', '2')",6,60.0,3,3,新上 多层4房 楼层适中 快满两年 毛坯自主装修 无车位,"['配套成熟', '环境优美', '交通便利']",221.0
2265,16067,89,2016,143,3,131,"('3', '2')",18,144.0,2,3,临安青山湖科技城 地铁口 中天珺府电梯洋房 无需社保 大三房,"['新房房源', '南北通透', '小户型']",393.0
2266,8923,65,2009,58,15,7,"('2', '2')",11,66.0,1,1,急！首付三成！外地人可买，70年产权精装修住宅，可落户送车位,"['近地铁', '近学校', '南北通透']",105.0
2267,25421,88,2017,225,10,23,"('3', '2')",17,136.0,3,3,首付60多万 九堡昆盛肖邦 可读东城实验 三开间朝南 纯毛坯,"['近地铁', '环境优美', '次新小区']",230.0
2268,17275,131,2018,227,8,45,"('4', '2')",33,330.0,2,3,杭海新城 一线江景房 侨福一品 大四房 双卫 精装全价可议,['南北通透'],360.0
2269,10277,47,2013,48,10,23,"('3', '2')",9,72.0,1,1,急售，70年产权住宅房，可落户，可上学，交通便利，南北通透。,"['南北通透', '配套成熟', '交通便利']",230.0
2270,13158,133,2011,175,8,45,"('3', '2')",11,88.0,2,3,星星港湾 一线江景 电梯房 楼层好 视野开阔,"['主卧朝南', '大平层', '景观房']",360.0
2271,9762,47,2014,45,10,1,"('3', '2')",17,136.0,1,1,外地人可买 可落户 可上学 70年产权 精装三房 配套齐全,"['南北通透', '近地铁', '繁华地段']",10.0
2272,10938,32,2016,35,13,98,"('3', '2')",12,96.0,1,1,小石桥社区！精装小3房不限沟，地下产权车位，名额有限！！！,"['送车位', '近地铁', '配套成熟']",1274.0
2273,39331,71,2016,280,10,97,"('2', '2')",16,96.0,4,4,火车东站800米 天阳文晖 16年的商品房精装交付 刚满两年,['南北通透'],970.0
2274,13196,97,2018,128,3,12,"('3', '2')",18,144.0,2,3,临安城区 美好锦玺 石镜小學 地铁800米 刚需大三房低总价,"['新房房源', '南北通透', '环境优美']",36.0
2275,11667,18,2013,21,2,9,"('2', '2')",9,54.0,1,1,你没看错 首付5万！即买即过户落户，独立产证，交通便利，包税,"['送车位', '近地铁', '繁华地段']",18.0
2276,10455,22,2014,23,13,50,"('3', '2')",12,96.0,1,1,首付7万，业主公司危机，急需资金周转，无需社保，刚装修好没住,"['新房房源', '配套成熟', '交通便利']",650.0
2277,22879,89,2015,205,13,17,"('3', '2')",27,216.0,3,3,御景蓝湾 满两年 毛坯大三房 户型方正  高架在建 交通方便,"['环境优美', '次新小区', '交通便利']",221.0
2278,23918,121,2010,290,10,21,"('3', '2')",15,120.0,3,4,金雅苑  东边套 大三房 南北通透 精装修 诚心出售,"['近地铁', '配套成熟', '交通便利']",210.0
2279,9620,50,2014,48,10,1,"('2', '2')",15,90.0,1,1,天降好房 包税 外地人可买 可落户上学 近地铁 送精装带车位,"['近地铁', '繁华地段', '品质小区']",10.0
2280,29679,77,2016,229,10,79,"('3', '2')",17,136.0,4,3,艮北新城 阳光城普升 刚需精装三房朝南 软装 ！,"['近地铁', '南北通透', '品质小区']",790.0
2281,32243,88,2019,285,13,130,"('3', '2')",20,160.0,4,4,东方悦府 1号线地铁口 滨江品质 全明户型 楼层采光好 诚售,"['环境优美', '交通便利', '素质住户']",1690.0
2282,11489,47,2007,54,13,50,"('3', '2')",13,104.0,1,1,房东很诚心卖， 房子是已经看好了！模范小区，公司力推！！！,"['南北通透', '小户型', '近地铁']",650.0
