,mean_price,capacity,time,price,area,region,room_type,house_level,type,mean_price_level,price_level,title,labels,position
711,13253,79,2012,105,13,50,"('2', '2')",22,132.0,2,3,嘉丰公馆，潘水路地铁口300米，精装送家电，租金5千，可落户,"['近地铁', '拎包入住', '配套成熟']",650.0
712,28143,70,2018,197,13,123,"('4', '2')",56,560.0,4,3,举步奥体大莲花 山水精工匠造 傲立钱塘江畔 奥体核心资产,['配套成熟'],1599.0
713,13766,47,2014,64,4,20,"('3', '2')",13,104.0,2,2,劲爆！！！豪华精装今次一套！首付只需10万！（附赠18平）,"['全南户型', '南北通透', '大开间']",80.0
714,26447,197,2017,521,5,126,"('3', '2')",2,16.0,3,4,房东因公司要上市，资金不足故急售。超。级诚心 价到签约,"['近地铁', '配套成熟', '品质小区']",630.0
715,44850,82,2016,371,13,123,"('4', '1')",13,65.0,4,4,房源保真 美哉美城 哇塞 好房子 买一套吧 好的,['近地铁'],1599.0
716,15217,47,2013,71,4,13,"('3', '2')",15,120.0,2,2,首付14万起，地铁口，刚需必买，精装修带车位，通燃气，无税！,"['近地铁', '配套成熟', '品质小区']",52.0
717,26759,89,2016,240,13,77,"('4', '2')",27,270.0,3,4,郡望府 4室2厅2卫纯东边套采光无挡南北通透格局合理,[],1001.0
718,14889,45,2014,67,12,68,"('2', '2')",17,102.0,2,2,萧山滨江区，70年住宅房，地铁口两百米，无需社保即可上学!,"['南北通透', '带车库', '近地铁']",816.0
719,13277,47,2014,62,15,56,"('2', '2')",11,66.0,2,1,外地人可买，无需社保，产权清晰，首付12万，月供4千，租金高,"['配套成熟', '交通便利', '繁华地段']",840.0
720,12822,70,2013,90,4,13,"('3', '2')",18,144.0,2,2,投姿守选！支持0 首付！外地人可买！包办落户！赠19平送车位,"['近地铁', '繁华地段', '品质小区']",52.0
721,20159,89,2017,180,4,14,"('3', '2')",40,320.0,3,3,临平北 三开间朝南 户型正气 双卫生间 大阳台 采光充足,"['配套成熟', '繁华地段', '品质小区']",56.0
722,13766,47,2016,64,4,20,"('3', '2')",12,96.0,2,2,圆你杭州梦！七十年产权 學区學院 南北通透 水电民用 包租！,"['拎包入住', '配套成熟', '品质小区']",80.0
723,19853,70,2012,140,10,1,"('2', '2')",13,78.0,3,3,长睦锦苑 毛坯房出售客厅带阳台采光好 地铁口 大润发旁,"['客厅朝南', '厅带阳台', '繁华地段']",10.0
724,11591,44,2014,51,13,98,"('2', '2')",8,48.0,1,1,70年产权住宅！产证清晰！外地人可买可落户上学！精装两房,"['南北通透', '采光好', '配套成熟']",1274.0
725,27302,106,2009,290,13,130,"('2', '2')",26,156.0,4,4,店长力推！闻堰商圈 40万装修全送 一线临江 不要错过哦！！,['拎包入住'],1690.0
726,19778,45,2010,89,13,123,"('3', '2')",18,144.0,3,2,出售)  佳丰北苑 精装3房南北通透全明户型 性价比高,"['南北通透', '环境优美', '交通便利']",1599.0
727,14130,46,2018,65,4,83,"('2', '2')",17,102.0,2,2,精装两房带家具 5.6米层高 租5000五常地铁口，透资者进,"['送家电', '送车位', '近地铁']",332.0
728,9553,76,2014,72,15,18,"('3', '2')",12,96.0,1,2,急售！春益小区直降21万 外地人可买 可落户送产权车位！！,"['近地铁', '配套成熟', '品质小区']",270.0
729,17447,47,2012,82,10,38,"('2', '2')",12,72.0,2,2,（老婆劈腿西门庆急出房源分家产）不让对方多拿一分钱 速速来电,"['近地铁', '配套成熟', '品质小区']",380.0
730,32134,38,2000,125,10,124,"('1', '1')",17,34.0,4,3,"真人勘察实拍钱江新城少数带阳台精装酒店式公寓,自住出租均可","['南北通透', '拎包入住']",1240.0
731,10108,65,2013,65,13,77,"('3', '2')",14,112.0,1,2,70年产权！精装三房 南北通透 交通便利 拎包入住,"['南北通透', '拎包入住', '交通便利']",1001.0
732,9773,44,2014,43,15,122,"('2', '2')",20,120.0,1,1,(真实急售)拎包入住 满五唯一！产证清晰！精装无税，价格可谈,"['近地铁', '繁华地段', '品质小区']",1830.0
733,9571,70,2014,67,4,14,"('3', '2')",11,88.0,1,2,外地人首付仅需15万可落户杭州！来电再减5万 无税精装送车位,"['送车位', '配套成熟', '繁华地段']",56.0
734,17353,35,2014,61,1,53,"('2', '2')",18,108.0,2,1,必看房源，精装修首付10万，产证齐全，70独立产权，送车位！,"['近地铁', '素质住户', '品质小区']",53.0
735,11249,73,2013,82,15,56,"('2', '2')",13,78.0,1,2,房东包税 直降25万 配套齐全 产权清晰无纠纷 喜欢可咨询,"['近地铁', '配套成熟', '交通便利']",840.0
736,65899,379,2017,2500,10,38,"('5', '2')",32,384.0,4,4,小西湖 华家池 世茂天宸 总层私邸 跃层,"['近地铁', '新房房源', '卫浴全明']",380.0
737,11054,56,2013,62,15,6,"('2', '2')",15,90.0,1,1,精装复式公寓 包租5千 产证清晰 房东急售 直降10万,[],90.0
738,11946,56,2012,66,4,13,"('3', '2')",33,264.0,1,2,重点学校旁 上学方便再减10万价格可谈 无需社保 产证齐全,"['环境优美', '繁华地段', '品质小区']",52.0
739,17234,47,2010,81,15,6,"('2', '2')",33,198.0,2,2,底价捡漏房源出售，首付低月供低，可以住2室2厅2卫，精装修,"['送家电', '配套成熟', '繁华地段']",90.0
740,11538,52,2015,60,10,103,"('2', '2')",12,72.0,1,1,善良的王阿姨儿子身患白血病，急需治疗，低于市场价，三天过户！,"['近地铁', '繁华地段', '品质小区']",1030.0
741,7077,65,2001,46,3,12,"('3', '2')",15,120.0,1,1,"产权清晰随时可过户,精装修|家具配套齐全|随时看房|送车位|","['南北通透', '环境优美', '素质住户']",36.0
742,10000,60,2014,60,10,1,"('2', '2')",15,90.0,1,1,首付8万 外地人可买 可落户上学 70年产权 送车位无税,"['近地铁', '配套成熟', '繁华地段']",10.0
743,35893,85,2015,308,10,97,"('3', '1')",16,64.0,4,4,天城府 东站近 次新房 开发商精装 满2年 地段好 楼层好,['南北通透'],970.0
744,11682,44,2014,51,7,69,"('3', '2')",20,160.0,1,1,房东大甩卖！首付只要13万！70年产权！总价低！送家电送车位,"['全南户型', '大开间', '双阳台']",483.0
745,31111,45,2019,140,12,34,"('1', '2')",28,112.0,4,3,江滨澜廷一线江景房，滨江CBD地标，江陵路地铁口,"['新房房源', '南北通透', '繁华地段']",408.0
746,14950,48,2014,72,15,122,"('2', '2')",12,72.0,2,2,赠十六平   房东回老家发展    诚心出售 小忙  请来电,"['配套成熟', '安全性高', '品质小区']",1830.0
747,45465,129,2004,590,7,54,"('3', '2')",13,104.0,4,4,"乐堤港锦昌文华 精装修3房2卫 全明户型,南北通透诚售 卖小",['南北通透'],378.0
748,23256,43,2019,100,12,91,"('2', '2')",28,168.0,3,2,滨江高润云杉郡精装公寓南北通透 无缝衔接地铁6号线,"['新房房源', '南北通透', '繁华地段']",1092.0
749,68963,144,2018,995,12,116,"('4', '2')",17,170.0,4,4,金茂府 滨江地铁景观房 开发商精装 新风恒温系统 奥体板块,"['近地铁', '配套成熟', '繁华地段']",1392.0
750,7213,61,2013,44,13,50,"('3', '2')",17,136.0,1,1,急售，低于市场价10万，精装修2房，送家电，拎包入住随时看房,"['近地铁', '繁华地段', '品质小区']",650.0
751,18514,43,2013,80,10,22,"('2', '2')",16,96.0,3,2,首付一成！业主跟随女儿出国定居！家电齐全当天可过户。拎包入住,"['近地铁', '交通便利', '繁华地段']",220.0
752,43225,60,1995,260,1,121,"('2', '1')",7,21.0,4,4,"天地本部全明户型精装修,电梯两房房东诚心出售,价格可以再谈!","['近地铁', '次新小区', '交通便利']",121.0
753,15625,80,2018,125,12,34,"('2', '2')",28,168.0,2,3,区政府地铁口，精装两房，小户型公寓，送家具家电，挑高5米,"['南北通透', '安全性高', '繁华地段']",408.0
754,52640,62,2001,330,14,72,"('3', '2')",6,48.0,4,4,文三街十三中 急降60万 送30万豪装 东边套全明 送双车位,"['近学校', '送车位', '近地铁']",1008.0
755,14764,50,2014,75,15,122,"('2', '2')",8,48.0,2,2,首付17w，房主急售送精装送车位，7天过户，可直接拎包入住,"['拎包入住', '配套成熟', '环境优美']",1830.0
756,29729,89,2015,265,15,5,"('2', '2')",22,132.0,4,4,下沙大学城核心坐拥双地铁的 现房 城市繁华中的一片宁静,[],75.0
757,35342,89,2018,315,13,33,"('3', '2')",34,272.0,4,4,"房东诚售滨江江南之星 大三房,户型方正,有钥匙随时看房,满二",['南北通透'],429.0
758,25685,58,2016,150,12,91,"('2', '2')",23,138.0,3,3,彩虹城板块 精装2房 客厅挑高 业主换房诚售 有钥匙诚售,[],1092.0
759,24872,47,2017,116,13,123,"('2', '2')",18,108.0,3,3,"奥体亚运村 山水时代 精装私寓, 3地铁交通便利 地标性建筑","['南北通透', '环境优美']",1599.0
760,8448,58,2012,49,4,26,"('2', '2')",12,72.0,1,1,70年产权精装修住宅.收付3成.南北通透.可落户可上学.,"['安全性高', '繁华地段', '品质小区']",104.0
761,6571,84,2015,55,13,123,"('3', '2')",32,256.0,1,1,路过必看减减首付8万 地铁口精装小俩房 家电齐全送车位！,"['近地铁', '配套成熟', '品质小区']",1599.0
762,17333,45,2017,78,14,120,"('3', '2')",7,56.0,2,2,急售产权清晰可落户上学不限贷 水电民用有管煤 刚需必备联系我,"['南北通透', '环境优美', '安全性高']",1680.0
763,58296,89,2011,520,12,68,"('3', '2')",34,272.0,4,4,水晶城，精装大三房，带露台，边套，宝龙城对面，江景房满五税少,"['赠露台', '视野好', '品质小区']",816.0
764,74980,184,2000,1380,12,68,"('4', '2')",24,240.0,4,4,柳岸晓风实体照 改善品质大四房 6000豪装带地暖 一线江景,['南北通透'],816.0
765,17604,52,2013,93,4,83,"('3', '2')",17,136.0,2,2,业主急售，赠送车位，配套齐全，近地铁，可落户上学，无税精装修,"['送车位', '配套成熟', '繁华地段']",332.0
766,44007,129,2018,572,13,33,"('4', '2')",18,180.0,4,4,国悦府新出 西边套四房 三开间朝南 送30方地下储物间,"['近地铁', '配套成熟', '品质小区']",429.0
767,23421,38,2014,89,12,68,"('2', '1')",9,27.0,3,2,降价25万，诚心出售，70年产权，可落户上学，产齐全,"['近地铁', '配套成熟', '品质小区']",816.0
768,10857,35,2017,38,6,66,"('2', '1')",18,54.0,1,1,业主急售这套置换杭州市区的房子 要的快点啦  民用水电通燃气,"['送家电', '送车位', '拎包入住']",396.0
769,15108,38,2015,57,13,123,"('2', '2')",12,72.0,2,1,地铁口200米，70年产权住宅，租金4千起，外地人可买落户,"['一梯两户', '送车位', '近地铁']",1599.0
770,14149,47,2013,66,10,129,"('2', '2')",13,78.0,2,2,闸弄口地铁200米，产权清晰70年产权可落户可上学，附赠车位,"['近地铁', '配套成熟', '繁华地段']",1290.0
771,12895,38,2014,49,10,97,"('2', '2')",13,78.0,2,1,急售！！双地铁口精装三房 产证齐全 南北通透 无需设保可落户,"['南北通透', '近地铁', '配套成熟']",970.0
772,10417,60,2014,62,13,77,"('2', '2')",16,96.0,1,1,急抛！70年住宅房首付1成包租4000 可落户上学 南北通透,"['近地铁', '配套成熟', '品质小区']",1001.0
773,9139,72,2013,65,14,104,"('2', '2')",15,90.0,1,2,剑桥公社总价65.8万 西湖紫金港 外地人可买可落户送车位!,"['近地铁', '配套成熟', '品质小区']",1456.0
774,49903,144,2018,720,12,116,"('4', '2')",17,170.0,4,4,金茂府新 景观房 多房朝南 新风系统地暖 四季恒温系统,"['南北通透', '环境优美']",1392.0
775,41125,89,2016,370,4,25,"('3', '2')",7,56.0,4,4,西溪君庐 30万精装好房  客厅大 宽敞明亮  实木地板,[],100.0
776,30612,49,2014,150,4,27,"('3', '2')",20,160.0,4,3,未来科技城核心 股东自留房 送车位 白菜价,"['配套成熟', '繁华地段', '品质小区']",108.0
777,10319,47,2012,48,15,122,"('2', '2')",12,72.0,1,1,外地可买 精装婚房 无需社保 产齐 全南户型 赠家具家电,"['南北通透', '近地铁', '配套成熟']",1830.0
778,42029,116,2005,488,14,46,"('3', '2')",18,144.0,4,4,嘉绿名苑 新出精装三房两卫 户型正气 边套 降价诚心出售！,"['近学校', '近地铁', '配套成熟']",644.0
779,60901,139,2016,850,12,116,"('4', '2')",20,200.0,4,4,滨江金茂府 位置 精装修四房 四季恒温精装修诚心出售,"['南北通透', '环境优美']",1392.0
780,31333,75,2015,235,4,27,"('3', '2')",12,96.0,4,4,福利 未来科技城 精装送14方超大阳 送车位 无需社保,[],108.0
781,25915,92,2010,240,14,117,"('3', '2')",12,96.0,3,4,简装次新房 稀 缺小户型 买到就是赚到 地铁已经在挖,"['近地铁', '配套成熟', '品质小区']",1638.0
782,34902,88,2017,310,13,67,"('3', '2')",34,272.0,4,4,低于市场价30万 地铁口 品质小区 春江天玺 低于市场 捡漏,"['近地铁', '配套成熟', '繁华地段']",871.0
783,24112,394,2009,950,5,126,"('5', '2')",2,24.0,3,4,九龙山庄独栋别墅   小区环境优美，户型方正 房东诚意出售,"['配套成熟', '环境优美', '繁华地段']",630.0
784,10387,181,2016,188,9,86,"('4', '2')",3,30.0,1,3,新挂牌真实价格！没有人傻到开高价，花园150平。赠送精装具电,"['配套成熟', '环境优美', '交通便利']",774.0
785,12360,89,2014,110,3,12,"('3', '2')",11,88.0,2,3,衣锦人家 房东急售 边套采光好 精装修 临近地铁口,"['安全性高', '繁华地段', '品质小区']",36.0
786,18971,89,2010,170,4,128,"('2', '2')",26,156.0,3,3,真 未来科技城板块 老余杭双地铁口精装两房低总价,"['近地铁', '配套成熟', '交通便利']",512.0
787,13483,89,2018,120,3,131,"('3', '2')",17,136.0,2,3,青山湖科技城 越秀国企开发商 大三房 近地铁口 总价120万,['新房房源'],393.0
788,13269,104,2016,138,3,131,"('3', '2')",18,144.0,2,3,买房投滋请点击！！！足不出户就找到好房！！,[],393.0
789,37007,162,2016,600,13,95,"('4', '2')",16,160.0,4,4,奥体南改善大宅 地铁口 急售房源 单价4W2 中央空调加地暖,"['近地铁', '南北通透', '环境优美']",1235.0
790,35395,98,2014,348,13,95,"('3', '2')",34,272.0,4,4,1滨萧交接 萧山四大豪宅之一  三房两卫赠30方,"['近地铁', '南北通透']",1235.0
791,36725,285,2003,1050,5,126,"('5', '2')",2,24.0,4,4,七里香溪价格真实无虚假！地鉄口独栋大花园集中朝南 看房有钥匙,"['配套成熟', '环境优美', '繁华地段']",630.0
792,19602,88,2012,172,4,27,"('3', '2')",12,96.0,3,3,赠送25平！外地人可买！产权清晰！地铁！送产权车位！对口名校,"['近地铁', '配套成熟', '繁华地段']",108.0
793,17683,82,2015,145,8,45,"('3', '2')",29,232.0,2,3,（新上好房）盈都揽悦82方纯毛坯小三房 次卧带阳台 两房朝南,"['配套成熟', '繁华地段', '品质小区']",360.0
794,26927,89,2018,240,14,117,"('3', '2')",18,144.0,3,4,21  70年产权适合 买到就是赚到而且不用摇号刚需赶紧上车,[],1638.0
795,20025,47,2016,95,15,122,"('1', '1')",22,44.0,3,2,泰美国际大厦， 朝南跃层， 精装厅室分明 ，金沙湖绿城物业,"['近地铁', '繁华地段', '品质小区']",1830.0
796,21464,259,2014,556,4,25,"('2', '2')",14,84.0,3,4,高端大气上档次低调奢华有内涵,[],100.0
797,17836,34,2018,61,14,120,"('2', '2')",4,24.0,2,1,西湖云栖小镇 星云公寓精装 4.8米层高双钥匙带露台空中花园,"['新房房源', '近地铁', '繁华地段']",1680.0
798,10836,64,2015,70,4,52,"('2', '2')",18,108.0,1,2,诚售|首付三成|外地人可买|可落户上学|产证齐全|无抵押,"['近地铁', '繁华地段', '品质小区']",208.0
799,18182,121,2019,220,3,12,"('4', '2')",27,270.0,3,3,青山地铁16号线500米 大型商业宝龙广场对面,['南北通透'],36.0
800,16949,59,2013,100,15,6,"('2', '2')",17,102.0,2,2,保利湾天地边套59方LOFT送一整层空间大光照好看房有钥匙,"['南北通透', '拎包入住', '环境优美']",90.0
801,15957,94,2012,150,8,45,"('3', '2')",18,144.0,2,3,星星港湾 一线江景 电梯房 精装修 三房，全明户型,"['拎包入住', '视野好', '品质小区']",360.0
802,32558,86,2005,280,13,95,"('3', '2')",5,40.0,4,4,水城排 精致3房2卫 精装修30万家具全送拎包入住,"['近地铁', '近学校', '南北通透']",1235.0
803,11932,44,2012,52,7,69,"('2', '2')",18,108.0,1,1,三墩地铁口，精装俩房，赠送18平，产过户，可上学，外地可购,"['近地铁', '配套成熟', '繁华地段']",483.0
804,23333,30,2017,70,14,101,"('2', '2')",6,36.0,3,2,西湖区南北通透 有阳台 阿里云硒旁 4.8米LOFT 地铁口,"['新房房源', '近地铁', '配套成熟']",1414.0
805,10535,50,2014,52,4,128,"('2', '2')",16,96.0,1,1,70年产权住宅，首付12万，不限购，外地人可买，送产权车位,"['送车位', '近地铁', '繁华地段']",512.0
806,17286,35,2015,60,14,120,"('1', '2')",18,72.0,2,1,捡漏房 急售地铁口精装LOFT免稅复式 买房送跨年演唱会门票,"['南北通透', '环境优美']",1680.0
807,36562,89,2014,328,13,130,"('3', '2')",29,232.0,4,4,滨江东方海岸 一线江景房 精装30万全送 满两年 随时看房,"['安全性高', '繁华地段', '品质小区']",1690.0
808,29837,402,2015,1200,13,123,"('5', '2')",28,336.0,4,4,滨江奥体中心 帝宝大厦 豪华装修 一线江景  杭州汤臣一品,[],1599.0
809,30000,60,2019,180,10,38,"('3', '2')",36,288.0,4,3,（新开三钥匙户型总价仅需68万起） 绿地集团匠心打造可包租,"['新房房源', '南北通透', '近地铁']",380.0
810,35955,89,2014,320,10,22,"('4', '2')",13,130.0,4,4,江干主城区，江景房，带车位，随时看房,[],220.0
811,13333,96,2019,128,3,131,"('4', '2')",17,170.0,2,3,青山湖科技城核心 轻轨旁 商圈旁 越秀打造 高品质生活住宅,"['新房房源', '近地铁', '配套成熟']",393.0
812,15105,71,2013,108,13,130,"('3', '2')",16,128.0,2,3,周边配套齐全，精装两房朝南，首付28万起，南北通透，拎包入住,"['南北通透', '拎包入住', '交通便利']",1690.0
813,86990,183,2018,1600,12,68,"('4', '2')",24,240.0,4,4,一线江景 高层好视野 绿城物业 网红楼房,"['配套成熟', '素质住户', '品质小区']",816.0
814,10400,50,2014,52,13,50,"('2', '2')",10,60.0,1,1,70年产权住宅房丨精装修丨外地人可买丨首付三成丨欢迎咨询！！,"['送车位', '近地铁', '交通便利']",650.0
815,14307,47,2014,68,13,50,"('2', '2')",12,72.0,2,2,赠送20平 精装两房 70年产权 无需社保 可落户上学 包税,"['近地铁', '南北通透', '配套成熟']",650.0
816,39387,45,1997,180,2,96,"('2', '1')",7,21.0,4,3,潮鸣苑 小套 直降12W 总价低,['近学校'],192.0
817,41895,58,1997,245,2,96,"('2', '1')",7,21.0,4,4,单价低 南北通透 厨卫全明 两房朝南 户型正气 看房随时,['近学校'],192.0
818,47144,156,2004,738,2,30,"('4', '1')",20,100.0,4,4,凤起都市花园 三房朝南 楼层好 正对小区花园 满五 青蓝,"['近地铁', '近学校']",60.0
819,33109,138,2016,458,14,104,"('4', '2')",15,150.0,4,4,城西未来科技城核心，高品质住宅大面积改善户型，学校配套,['近学校'],1456.0
820,32408,87,2017,285,13,33,"('3', '2')",29,232.0,4,4,银河北干学府 地铁口 精装三房 配套齐全 89方刚需户型,"['近地铁', '次新小区', '品质小区']",429.0
821,17578,88,2013,155,4,11,"('2', '2')",27,162.0,2,3,房东非常诚心出售，钥匙已经委托给我了，大两房户型好，高楼层,"['采光好', '房型正', '视野好']",44.0
822,23636,55,2015,130,4,83,"('2', '2')",11,66.0,3,3,未来科技城 地铁口现房诀版4.8米复式类住宅 民用电通天然气,"['近地铁', '配套成熟', '繁华地段']",332.0
823,24008,116,2010,280,4,14,"('3', '2')",3,24.0,3,4,绿城蓝庭洋房！年前急售！满两年！9号线旁！可住可租！,"['近地铁', '配套成熟', '繁华地段']",56.0
824,16537,41,2013,68,13,123,"('2', '2')",12,72.0,2,2,不限购 精装修拎包入住 独立产证 外地人可买 民用水电 急售,"['近地铁', '南北通透', '送车位']",1599.0
825,8095,63,2014,51,13,77,"('2', '2')",19,114.0,1,1,地铁口精装修现房，对面就是大商场，户型正气，小户型，诚意出售,"['配套成熟', '交通便利', '繁华地段']",1001.0
826,22693,91,2010,208,4,78,"('3', '2')",9,72.0,3,3,东边套，品质小区，居家装修17万，地铁700米，拎包入住,"['南北通透', '近地铁', '环境优美']",312.0
827,23720,50,2017,118,12,34,"('1', '1')",22,44.0,3,3,滨江区政府 地铁口汉峰公馆精装现房4.8米层高 内部保留房源,"['南北通透', '近地铁', '环境优美']",408.0
828,11448,67,2015,76,14,117,"('2', '2')",27,162.0,1,2,外地人可买，首付20万可，70年产权住宅，带车位，赠7平方！,"['送家电', '送车位', '房型正']",1638.0
829,12324,37,2015,45,10,4,"('2', '2')",15,90.0,2,1,70年住宅，来电减5万，赠送30平大面积，产权清晰，拎包入住,"['近地铁', '次新小区', '繁华地段']",40.0
830,20690,58,2014,120,4,83,"('2', '1')",17,51.0,3,3,未来科技城板块，地铁0距离，房东急售，随时看房,[],332.0
831,11608,80,2015,93,2,9,"('3', '2')",11,88.0,1,2,首付3成起！来电立减5W！产权清晰，可立即过户！外地可买！！,"['南北通透', '送车位', '交通便利']",18.0
832,77153,194,2019,1500,12,68,"('4', '2')",24,240.0,4,4,一线钱塘江景观！钱塘江畔（滨江）奢华豪宅重磅来袭 绿城品质,"['南北通透', '环境优美']",816.0
833,25238,42,2017,106,14,120,"('2', '2')",15,90.0,3,3,（过年点击有红包）西湖之江 6号线0距离 自带大型综合体,"['新房房源', '近地铁', '配套成熟']",1680.0
834,40529,136,2016,552,4,11,"('4', '2')",2,20.0,4,4,业主工作调动，降价48w捡漏出售，带中式精装修带车位！随时看,"['南北通透', '景观房', '品质小区']",44.0
835,9615,52,2014,50,4,14,"('3', '2')",13,104.0,1,1,70年精装住宅！首付1成，房东包税，送家电车位，心动者来电，,"['近地铁', '配套成熟', '品质小区']",56.0
836,18830,47,2014,88,14,118,"('3', '2')",14,112.0,3,2,西湖景区房 房东因工作调度急需转售 首付18万 来电立减8万,"['视野好', '交通便利', '繁华地段']",1652.0
837,19118,340,2013,650,3,131,"('5', '2')",1,12.0,3,4,房东诚售丨锦绣钱塘独栋丨800余方大花园丨低总价,[],393.0
838,16818,46,2013,77,15,18,"('2', '2')",15,90.0,2,2,急售！70年精装两房，首付10万，对口學区，南北通透，可落户,"['南北通透', '送车位', '近地铁']",270.0
839,22594,132,2009,300,13,130,"('3', '2')",26,208.0,3,4,绿城郁金香岸 西边套简装大三房 南北通透 房东诚心出售,['南北通透'],1690.0
840,65429,198,2008,1300,12,68,"('4', '2')",16,160.0,4,4,彩虹城 新出四房 三房南 一房北 豪华装修 南北通透 诚心卖,['近学校'],816.0
841,14839,62,2014,92,15,122,"('3', '2')",15,120.0,2,2,看房随时有钥匙性价比高 产正齐全 南北通透 无需社保 带车位,"['南北通透', '配套成熟', '环境优美']",1830.0
842,9600,50,2009,48,15,122,"('2', '2')",7,42.0,1,1,首付15万，地铁口的落户房子，业主在安徽的养猪场扩大需要资金,"['拎包入住', '近地铁', '交通便利']",1830.0
843,56323,168,2016,950,12,68,"('3', '2')",41,328.0,4,4,世茂之西湖 江景房 樱花大道旁 钱江大桥换乘站 户型通透,[],816.0
844,27447,47,2016,129,13,123,"('2', '2')",15,90.0,4,3,杭州奥体博览城，钱江世纪城地铁口，带阳台双钥匙精装修LOFT,"['南北通透', '环境优美']",1599.0
845,11087,89,2016,99,4,14,"('3', '2')",15,120.0,1,2,金世纪运河丽园曾经临平神盘房东老家出了特殊状况特价出售,"['近地铁', '配套成熟', '繁华地段']",56.0
846,15208,48,2014,73,15,122,"('2', '2')",10,60.0,2,2,1号线高沙路步行93米！首付11万，精装修特价房！业主急用钱,"['南北通透', '拎包入住', '近地铁']",1830.0
847,14872,39,2017,58,4,32,"('3', '2')",20,160.0,2,1,赠送19平，独享静逸人生，亦繁华亦宁静，无无须社保，外地可购,"['拎包入住', '近地铁', '配套成熟']",128.0
848,34002,116,2000,395,14,46,"('3', '2')",12,96.0,4,4,嘉绿西苑电梯三房 小区自带幼儿园 配套齐全 看房方便,"['近学校', '南北通透']",644.0
849,31183,88,2017,277,14,117,"('3', '2')",34,272.0,4,4,西湖铁建，三房两卫，求是星洲小学就在小区门口,[],1638.0
850,25979,103,2006,270,4,111,"('3', '1')",4,16.0,3,4,文化村精装修三房，房东！看中可谈！,['南北通透'],444.0
851,17776,112,2011,200,4,128,"('3', '2')",6,48.0,2,3,爵士大三房 满五年 采光好 南北通透 拎包即住  随时可看，,"['安全性高', '繁华地段', '品质小区']",512.0
852,14527,50,2013,73,12,68,"('2', '2')",19,114.0,2,2,滨江彩虹城丨首付15W起急售丨无需社保丨不限购限贷丨包租4K,"['拎包入住', '配套成熟', '品质小区']",816.0
853,10349,43,2006,44,15,122,"('2', '2')",12,72.0,1,1,品质小区，外地人可买，产齐全，配套成熟，南北通透，近地铁，,"['配套成熟', '安全性高', '繁华地段']",1830.0
854,20522,87,2019,180,13,17,"('3', '2')",27,216.0,3,3,御景蓝湾 纯毛坯 满2年 诚心卖 全明户型 三开间朝南,"['南北通透', '近地铁', '配套成熟']",221.0
855,9069,88,2016,80,15,56,"('3', '2')",17,136.0,1,2,景观好，楼层好，超低市场价，随时看房！,"['近地铁', '配套成熟', '品质小区']",840.0
856,93834,52,2000,490,14,58,"('2', '1')",3,9.0,4,4,下宁巷新出 1楼带大院子 精装修 拎包入住 西边套 全天采光,"['安全性高', '繁华地段', '品质小区']",812.0
